{
  "schema_version": "unreal-static-mesh-profile@1.0.0",
  "profile_id": "demo-desktop-balanced",
  "profile_version": "1.0.0",
  "description": "Recording demo: mixed pass/fail desktop review. Values are training data, not studio standards.",
  "rules": {
    "triangle_budget": { "enabled": true, "max_lod0": 2000, "severity": "error" },
    "vertex_budget": { "enabled": true, "max_lod0": 1500, "severity": "error" },
    "material_slots": { "enabled": true, "max_count": 2, "severity": "warning" },
    "lod_count": { "enabled": true, "min_count": 1, "severity": "warning" },
    "nanite": { "enabled": true, "expected": "any", "severity": "warning" }
  }
}
